{
  "$defs": {
    "nonemptyStringArray": {
      "items": {
        "minLength": 1,
        "type": "string"
      },
      "minItems": 1,
      "type": "array",
      "uniqueItems": true
    }
  },
  "$id": "shieldkit-labs/poolactionfv1-refreeze-falsifier-contract/expectation-ledger-boundary/v2",
  "$schema": "https://json-schema.org/draft/2020-12/schema",
  "additionalProperties": false,
  "properties": {
    "authority": {
      "const": "none"
    },
    "expectationLedgerComplete": {
      "const": false
    },
    "expectationRowCount": {
      "const": 0
    },
    "expectationRows": {
      "maxItems": 0,
      "type": "array"
    },
    "futureLedgerArtifactPath": {
      "const": "research-lanes/bch-shielded-pool-design/evidence/poolactionfv1-refreeze-falsifier-attempt-v2/<attempt-id>/expectation-ledger.v2.json"
    },
    "futureLedgerSchemaRef": {
      "const": "expectation-ledger.v2.schema.json"
    },
    "immutableLedgerRequirements": {
      "$ref": "#/$defs/nonemptyStringArray",
      "maxItems": 8,
      "minItems": 8,
      "type": "array"
    },
    "packageId": {
      "const": "spec:poolactionfv1-refreeze-falsifier-contract-v2"
    },
    "rowLifecycle": {
      "items": {
        "enum": [
          "SELECT_AND_PIN_PROTOCOL_ARTIFACTS",
          "FREEZE_EXACT_VARIANT_ROSTER",
          "AUTHOR_EXPECTATIONS_WITHOUT_EXECUTION",
          "INDEPENDENT_EXPECTATION_REVIEW",
          "CANONICALIZE_HASH_AND_READ_ONLY_FREEZE",
          "BUILD_ISOLATED_COMPONENTS_OFFLINE",
          "EXECUTE_PRODUCER_SUT_AND_ORACLE",
          "COMPARATOR_ONLY_REFEREE",
          "SEAL_PER_ROW_RESULTS_AND_RECEIPT"
        ]
      },
      "maxItems": 9,
      "minItems": 9,
      "type": "array",
      "uniqueItems": true
    },
    "schema": {
      "const": "shieldkit-labs/poolactionfv1-refreeze-falsifier-contract/expectation-ledger-boundary/v2"
    },
    "separationRules": {
      "additionalProperties": false,
      "properties": {
        "oracleDenied": {
          "$ref": "#/$defs/nonemptyStringArray"
        },
        "producerDenied": {
          "$ref": "#/$defs/nonemptyStringArray"
        },
        "refereeAllowed": {
          "$ref": "#/$defs/nonemptyStringArray"
        },
        "refereeDenied": {
          "$ref": "#/$defs/nonemptyStringArray"
        },
        "sutDenied": {
          "$ref": "#/$defs/nonemptyStringArray"
        }
      },
      "required": [
        "oracleDenied",
        "producerDenied",
        "refereeAllowed",
        "refereeDenied",
        "sutDenied"
      ],
      "type": "object"
    },
    "status": {
      "const": "BLOCKED_VERSION_PIVOT_NO_REFREEZE"
    }
  },
  "required": [
    "authority",
    "expectationLedgerComplete",
    "expectationRowCount",
    "expectationRows",
    "futureLedgerArtifactPath",
    "futureLedgerSchemaRef",
    "immutableLedgerRequirements",
    "packageId",
    "rowLifecycle",
    "schema",
    "separationRules",
    "status"
  ],
  "type": "object"
}
