{
  "authority": "none",
  "expectationLedgerComplete": false,
  "expectationRowCount": 0,
  "expectationRows": [],
  "futureLedgerArtifactPath": "research-lanes/bch-shielded-pool-design/evidence/poolactionfv1-refreeze-falsifier-attempt-v2/<attempt-id>/expectation-ledger.v2.json",
  "futureLedgerSchemaRef": "expectation-ledger.v2.schema.json",
  "immutableLedgerRequirements": [
    "The final variant roster and every expected disposition and semantic stage are authored, independently reviewed, canonicalized, hashed, and made read-only before producer, SUT, or oracle execution.",
    "No expectation, expected stage, expected code, family membership, or antecedent relation may be derived from SUT, oracle, VM, node, compiler, or referee results.",
    "Each row changes exactly one stated invariant from named independently accepting positive antecedents; compound mutations are separate families or explicitly enumerated cross-product variants.",
    "Each negative row names all positive antecedents required to reach its exact rejection stage, and those antecedents must independently accept in the same pinned attempt.",
    "Each positive row expects ACCEPT at FINAL_ACCEPT; each negative row expects REJECT at one exact semantic stage; a precondition row may expect REFUSE only at PRECONDITION_REFUSAL.",
    "Wildcard, any-reject, implementation-native, result-derived, null, and __AUTO_STRICT__ expectations are forbidden.",
    "Every row has a stable case ID, stable variant ID, one RF family ID, exact mutation description, exact expected disposition, exact semantic stage, and pinned input digest.",
    "The ledger is complete only when every frozen variant appears exactly once, every referenced antecedent exists, family and variant arithmetic reconcile, and an independent reviewer signs the ledger digest."
  ],
  "packageId": "spec:poolactionfv1-refreeze-falsifier-contract-v2",
  "rowLifecycle": [
    "SELECT_AND_PIN_PROTOCOL_ARTIFACTS",
    "FREEZE_EXACT_VARIANT_ROSTER",
    "AUTHOR_EXPECTATIONS_WITHOUT_EXECUTION",
    "INDEPENDENT_EXPECTATION_REVIEW",
    "CANONICALIZE_HASH_AND_READ_ONLY_FREEZE",
    "BUILD_ISOLATED_COMPONENTS_OFFLINE",
    "EXECUTE_PRODUCER_SUT_AND_ORACLE",
    "COMPARATOR_ONLY_REFEREE",
    "SEAL_PER_ROW_RESULTS_AND_RECEIPT"
  ],
  "schema": "shieldkit-labs/poolactionfv1-refreeze-falsifier-contract/expectation-ledger-boundary/v2",
  "separationRules": {
    "oracleDenied": [
      "expectation ledger",
      "expected disposition",
      "expected stage",
      "case ID",
      "family ID",
      "variant ID",
      "mutation metadata",
      "producer output",
      "SUT output"
    ],
    "producerDenied": [
      "expectation ledger",
      "expected disposition",
      "expected stage",
      "SUT output",
      "oracle output"
    ],
    "refereeAllowed": [
      "frozen expectation ledger",
      "producer input digest and public case order",
      "SUT per-row results",
      "oracle per-row results",
      "component and attempt pins"
    ],
    "refereeDenied": [
      "protocol parsing",
      "serialization",
      "digest computation",
      "root computation",
      "membership computation",
      "expectation synthesis",
      "case mutation"
    ],
    "sutDenied": [
      "expectation ledger",
      "expected disposition",
      "expected stage",
      "case ID",
      "family ID",
      "variant ID",
      "mutation metadata",
      "producer output other than the opaque case bytes",
      "oracle output"
    ]
  },
  "status": "BLOCKED_VERSION_PIVOT_NO_REFREEZE"
}
